#,Title,Artist,Album,Length,BPM,Genre,Label,Composer,Remixer,Year,File name
1,"01 Martin Garrix gravity intro v3.wav","","",285,0,"","","","",0,"C:/Users/Jan/OneDrive/DJing/Intros/01 Martin Garrix gravity intro v3.wav"
2,"LMFAO - Party Rock Anthem (Lyrics) ft. Lauren Bennett, GoonRock","Loku","",296,0,"","","","",2020,"C:/Users/Jan/OneDrive/DJing/Vivis Party/Vivis BD Full List V1 Files/LMFAO - Party Rock Anthem (Lyrics) ft. Lauren Bennett, GoonRock.mp3"
3,"Good Grief (Don Diablo Remix) (Don Diablo Remix)","Bastille","",239,0,"Dance/Mainstream Club","","","",2016,"C:/Users/Jan/OneDrive/DJing/new from ZipDJ/zipdjtracks_2025-12-27_02-09-58_694f3feaad883/Bastille-Good_Grief__Don_Diablo_Remix_-Don_Diablo_Remix-76642405.mp3"
4,"Hangover [Intro Clean]","Taio Cruz ft Flo-Rida","BPMsupreme.com",260,128,"Pop","www.BPMsupreme.com","www.BPMsupreme.com","",2011,"C:/Users/Jan/OneDrive/DJing/Vivis Party/Vivis BD Full List V1 Files/4 Hangover [Intro Clean].mp3"
5,"Titanium (feat. Sia) (Extended) (Short Edit)","David Guetta","Titanium (feat. Sia)",252,0,"Dance","","","",2012,"C:/Users/Jan/OneDrive/DJing/Edits/01 - Titanium (feat. Sia) (Extended) (Short Edit).flac"
6,"Toxic (Cut End)","Britney Spears","In The Zone",141,0,"Pop","Jive","Cathy Dennis/Henrik Jonback/Christian Karlsson/Pontus Winnberg","",2003,"C:/Users/Jan/OneDrive/DJing/Edits/Britney Spears - Toxic (Cut End).mp3"
7,"Scream & Shout (Added Silence before Start)","will.i.am/Britney Spears","#willpower",284,0,"","","","",2013,"C:/Users/Jan/OneDrive/DJing/Edits/Scream & Shout (Added Silence before Start).mp3"
8,"DJ Got Us Fallin' In Love (feat. Pitbull)","USHER/Pitbull","Raymond v Raymond (Expanded Edition)",214,0,"","","","",2010,"C:/Users/Jan/OneDrive/DJing/other stuff/DJ Got Us Fallin' In Love (feat. Pitbull).mp3"
9,"Language (Extended Mix)","Porter Robinson","Porter Robinson EP Japan Limited Edition",371,0,"","","Porter Robinson","",2013,"C:/Users/Jan/OneDrive/DJing/EDM/02 Language (Extended Mix).flac"
10,"Zedd - Clarity (feat. Foxes)","Zedd","",272,0,"Music","","","",2012,"C:/Users/Jan/OneDrive/DJing/EDM/LQ Zedd - Clarity (feat. Foxes).mp3"
11,"Cinema (Extended)","Benny Benassi, Gary Go","Cinema",296,0,"Music","","","",2017,"C:/Users/Jan/OneDrive/DJing/Mainstream/LQ Cinema (Extended).mp3"
12,"Billie Jean (RELOVA Extended Edit) (Short Edit) ","Michael Jackson","Billie Jean (RELOVA Edit) - Single",215,0,"House","","","",2025,"C:/Users/Jan/OneDrive/DJing/Edits/02 Billie Jean (RELOVA Extended Edit) (Short Edit).mp3"
13,"Messy (Łaszewo Extended Edit)","Lola Young","Messy (Łaszewo Edit) - Single",258,0,"Future House","","","",2025,"C:/Users/Jan/OneDrive/DJing/EDM/02 Messy (Łaszewo Extended Edit).mp3"
14,"ICouldBetheOne-LaLaLa(Freqture)Extended (Short Edit)","Avicii, SamSmith, Freqture","",389,0,"EDM","","","",0,"C:/Users/Jan/OneDrive/DJing/Edits/ICouldBetheOne-LaLaLa(Freqture)Extended (Short Edit).m4a"
15,"Ordinary (Djs From Mars If I Lose Myself Bootleg) Clean (Short Edit)","Alex Warren","",154,130,"Pop Dance Mashup","","","",2025,"C:/Users/Jan/OneDrive/DJing/Edits/Alex Warren - Ordinary (Djs From Mars If I Lose Myself Bootleg) Clean 10A 130 (Short Edit).mp3"
16,"Only Girl (In The World)","Rihanna","Loud",236,0,"","","","",2010,"C:/Users/Jan/OneDrive/DJing/other stuff/Only Girl (In The World).mp3"
17,"Don't Start Now","Dua Lipa","Future Nostalgia",183,0,"Pop","","","",2020,"C:/Users/Jan/OneDrive/DJing/Mainstream/2. Don't Start Now.flac"
18,"Starships","Nicki Minaj","Pink Friday ... Roman Reloaded",211,0,"","","","",2011,"C:/Users/Jan/OneDrive/DJing/other stuff/Starships.mp3"
19,"Rasputin","Majestic/Boney M.","Rasputin",186,0,"","","","",2021,"C:/Users/Jan/OneDrive/DJing/Spotify/SpotiDownloader.com - BSN/Rasputin.mp3"
20,"Sexy Bitch (feat. Akon)","David Guetta/Akon","One More Love",196,0,"","","","",2010,"C:/Users/Jan/OneDrive/DJing/Spotify/SpotiDownloader.com - BSN 2/Sexy Bitch (feat. Akon).mp3"
21,"Hotel Room Service","Pitbull","Pitbull Starring In Rebelution",239,0,"","","","",2009,"C:/Users/Jan/OneDrive/DJing/Mainstream/Hotel Room Service.mp3"
22,"Can't Hold Us (feat. Ray Dalton)","Macklemore/Ryan Lewis/Macklemore & Ryan Lewis/Ray Dalton","The Heist",258,0,"","","","",2012,"C:/Users/Jan/OneDrive/DJing/other stuff/Can't Hold Us (feat. Ray Dalton).mp3"
23,"Locked Out Of Heaven (Clean) (Extended) (HD)","Bruno Mars","",249,73,"Top 40","","","",2012,"C:/Users/Jan/OneDrive/DJing/Mainstream/Bruno Mars - Locked Out Of Heaven (Clean) (Extended) (HD).mp4"
24,"Shake It Off","Taylor Swift","1989 (Deluxe Edition)",219,0,"Pop","","Taylor Swift, Max Martin, Shellback","",2147483647,"C:/Users/Jan/OneDrive/DJing/Mainstream/06. Shake It Off.flac"
25,"...Baby One More Time","Britney Spears","...Baby One More Time (Digital Deluxe Version)",211,0,"Pop","Jive","Max Martin","",1999,"C:/Users/Jan/OneDrive/DJing/Mainstream/Britney Spears - ...Baby One More Time.mp3"
26,"Lush Life","Zara Larsson","So Good",201,0,"Pop","Epic/Record Company TEN","Emanuel Abrahamsson/Mack/Linnea Södahl/Fridolin Walcher/Christoph Bauss/Iman Conta Hulten","",2017,"C:/Users/Jan/OneDrive/DJing/Mainstream/Zara Larsson - Lush Life.mp3"
27,"No Scrubs","TLC","90 Hits of the… 90s",238,0,"2000s Music","","","",2013,"C:/Users/Jan/OneDrive/DJing/Mainstream/TLC - No Scrubs.flac"
28,"Unwritten","Natasha Bedingfield","Unwritten",259,0,"Pop/Rock","","","",2005,"C:/Users/Jan/OneDrive/DJing/Mainstream/04 - Unwritten.flac"
29,"Hips Don't Lie","Shakira Ft. Wyclef Jean","Hitzone 38",217,0,"Top 40","","","",2006,"C:/Users/Jan/OneDrive/DJing/Mainstream/2558. Shakira Ft. Wyclef Jean - Hips Don't Lie [2006].flac"
30,"Levitating","Dua Lipa","Future Nostalgia",204,0,"Dance-Pop Nu-Disco","","","",2020,"C:/Users/Jan/OneDrive/DJing/Mainstream/05 - Dua Lipa - Levitating.flac"
31,"Palmen aus Plastik","Bonez MC & RAF Camora","Bravo Hits 95",186,0,"Pop","","","",2016,"C:/Users/Jan/OneDrive/DJing/Rap/014. Bonez MC & RAF Camora - Palmen aus Plastik.flac"
32,"Ferrari (Extended Mix)","James Hype, Miggy Dela Rosa","Ferrari",339,125,"dance / electro pop","The Cross","","",2022,"C:/Users/Jan/OneDrive/DJing/EDM/James Hype, Miggy Dela Rosa - Ferrari (Extended Mix).mp3"
33,"Ohne mein Team","Bonez MC/RAF Camora/Maxwell","Palmen aus Plastik",189,130,"Rap/Hip Hop","AUF!KEINEN!FALL!","","",2016,"C:/Users/Jan/OneDrive/DJing/Rap/05 - Ohne mein Team.mp3"
34,"No Broke Boys (Extended Mix)","Disco Lines, Tinashe","No Broke Boys",206,131,"Dance","","","",2025,"C:/Users/Jan/OneDrive/DJing/new from ZipDJ/zipdjtracks_2025-11-24_18-00-39_69249d2982ab0/Disco_Lines__Tinashe-No_Broke_Boys-Extended_Mix-75639505.mp3"
35,"Von Party zu Party","SXTN","Leben am Limit",224,0,"Hip hop","Jinx Music","","",2017,"C:/Users/Jan/OneDrive/DJing/Rap/03. Von Party zu Party.flac"
36,"Better Off Alone","Alice Deejay","Who Needs Guitars Anyway?",215,0,"","","","",2000,"C:/Users/Jan/OneDrive/DJing/Spotify/SpotiDownloader.com - BSN 3/Better Off Alone.mp3"
37,"Memories (Clean Extended)","David Guetta ft Kid Cudi","",251,130,"Dance Pop","Warner Music Group, Parlophone Records","","",2009,"C:/Users/Jan/OneDrive/DJing/Vivis Party/Vivis BD Full List V1 Files/2 David Guetta ft Kid Cudi - Memories (Clean Extended).mp3"
38,"S&M (Intro Clean)","Rihanna","",270,128,"Dance Pop","Universal Music Group, Def Jam Recordings","","",2010,"C:/Users/Jan/OneDrive/DJing/Vivis Party/Vivis BD Full List V1 Files/4 Rihanna - S&M (Intro Clean).mp3"
39,"Water","Tyla/Marshmello","Water",192,0,"","","","",2023,"C:/Users/Jan/OneDrive/DJing/Spotify/SpotiDownloader.com - BSN 4/Water.mp3"
40,"On The Floor","Jennifer Lopez/Pitbull","Love?",285,0,"","","","",2011,"C:/Users/Jan/OneDrive/DJing/Mainstream/On The Floor.mp3"
41,"Pump It Up - Dastic Remix","Danko/Dastic","Pump It Up (Dastic Remix)",161,0,"","","","",2020,"C:/Users/Jan/OneDrive/DJing/Spotify/SpotiDownloader.com - BSN 2/Pump It Up - Dastic Remix.mp3"
42,"Rather Be (feat. Jess Glynne) - OVERWERK Remix","Clean Bandit/Jess Glynne","Rather Be Remixes, Pt. 2",377,0,"","","","",2014,"C:/Users/Jan/OneDrive/DJing/Spotify/SpotiDownloader.com - BSN 4/Rather Be (feat. Jess Glynne) - OVERWERK Remix.mp3"
43,"Without You (feat. Sandro Cavazza)","Avicii/Sandro Cavazza","AVĪCI (01)",182,0,"","","","",2017,"C:/Users/Jan/OneDrive/DJing/Spotify/SpotiDownloader.com - BSN/Without You (feat. Sandro Cavazza).mp3"
44,"Maneater (Intro Clean)","Nelly Furtado","",217,133,"Pop","Universal Music Group, Geffen Records","","",2006,"C:/Users/Jan/OneDrive/DJing/Vivis Party/Vivis BD Full List V1 Files/4 Nelly Furtado - Maneater (Intro Clean).mp3"
45,"Dirty Diana (2012 Remaster)","Michael Jackson","Scream",281,131,"R&B Pop","Epic/Legacy","Michael Jackson Jerry Hey","",2017,"C:/Users/Jan/OneDrive/DJing/Mainstream/005 - Dirty Diana (2012 Remaster).mp3"
